Simulating for 10000 cycles...

Simulator halted

Current register values :
-------------------------------------
PC: 0x0040003c
Registers:
R0: 0x00000000
R1: 0x00000000
R2: 0x0000000a
R3: 0x00000800
R4: 0x1000000c
R5: 0x00000000
R6: 0x00000000
R7: 0x0000270f
R8: 0x0000230f
R9: 0xfffff3ff
R10: 0x000004ff
R11: 0x00000000
R12: 0x00000000
R13: 0x00000000
R14: 0x00000004
R15: 0x00000000
R16: 0x00000000
R17: 0x00640000
R18: 0x00000000
R19: 0x00000000
R20: 0x00000000
R21: 0x00000000
R22: 0x00000000
R23: 0x00000000
R24: 0x00000000
R25: 0x00000000
R26: 0x00000000
R27: 0x00000000
R28: 0x00000000
R29: 0x80000000
R30: 0x00000000
R31: 0x00000000

Data section [0x10000000..0x10000010] :
-------------------------------------
0x10000000: 0x00000003
0x10000004: 0x0000007b
0x10000008: 0x000010fa
0x1000000c: 0x11111111
0x10000010: 0x00000000


